{
  "schema_version": 1,
  "workspace_packages": {
    "production": [
      {
        "crate_root": "crates/jet3/src/lib.rs",
        "manifest": "crates/jet3/Cargo.toml",
        "name": "jet3"
      },
      {
        "crate_root": "crates/jet3-cli/src/main.rs",
        "manifest": "crates/jet3-cli/Cargo.toml",
        "name": "jet3-cli"
      },
      {
        "crate_root": "crates/jet3-testkit/src/lib.rs",
        "manifest": "crates/jet3-testkit/Cargo.toml",
        "name": "jet3-testkit"
      }
    ],
    "support": []
  },
  "allowed_runtime_packages": [
    "jet3",
    "jet3-cli",
    "jet3-testkit"
  ],
  "reviewed_build_scripts": [
    {
      "package": "jet3-cli",
      "manifest": "crates/jet3-cli/Cargo.toml",
      "path": "crates/jet3-cli/build.rs",
      "sha256": "f151f7b22a39451c3d71bf8e2bb400c73c6e1a0dbb4ffe02dbdffc226c94f029",
      "purpose": "Build identity only: embed the exact Git revision and dirty state; supplies no MDB format knowledge."
    }
  ],
  "reviewed_external_runtime_packages": [
    {
      "name": "bitflags",
      "version": "2.13.1",
      "source": "registry+https://github.com/rust-lang/crates.io-index",
      "checksum": "b588b76d00fde79687d7646a9b5bdf3cc0f655e0bbd080335a95d7e96f3587da",
      "allow_custom_build": false,
      "purpose": "Locked rustix closure for target-specific safe no-replace atomic publication; supplies no MDB format knowledge."
    },
    {
      "name": "errno",
      "version": "0.3.14",
      "source": "registry+https://github.com/rust-lang/crates.io-index",
      "checksum": "39cab71617ae0d63f51a36d69f866391735b51691dbda63cf6f96d042b63efeb",
      "allow_custom_build": false,
      "purpose": "Locked rustix closure for target-specific safe no-replace atomic publication; supplies no MDB format knowledge."
    },
    {
      "name": "libc",
      "version": "0.2.189",
      "source": "registry+https://github.com/rust-lang/crates.io-index",
      "checksum": "3eaf3ede3fee6db1a4c2ee091bf8a8b4dccdc6d17f656fb07896ee72867612f2",
      "allow_custom_build": true,
      "purpose": "Locked rustix closure for target-specific safe no-replace atomic publication; supplies no MDB format knowledge."
    },
    {
      "name": "linux-raw-sys",
      "version": "0.12.1",
      "source": "registry+https://github.com/rust-lang/crates.io-index",
      "checksum": "32a66949e030da00e8c7d4434b251670a91556f4144941d37452769c25d58a53",
      "allow_custom_build": false,
      "purpose": "Locked rustix closure for target-specific safe no-replace atomic publication; supplies no MDB format knowledge."
    },
    {
      "name": "rustix",
      "version": "1.1.4",
      "source": "registry+https://github.com/rust-lang/crates.io-index",
      "checksum": "b6fe4565b9518b83ef4f91bb47ce29620ca828bd32cb7e408f0062e9930ba190",
      "allow_custom_build": true,
      "purpose": "Safe no-replace atomic publication on supported Unix targets; supplies no MDB format knowledge."
    },
    {
      "name": "same-file",
      "version": "1.0.6",
      "source": "registry+https://github.com/rust-lang/crates.io-index",
      "checksum": "93fc1dc3aaa9bfed95e02e6eadabb4baf7e3078b0bd1b4d7b6b0b68378900502",
      "allow_custom_build": false,
      "purpose": "Safe Windows file-identity handles retained through final staging validation and released before atomic bundle rename; supplies no MDB format knowledge."
    },
    {
      "name": "winapi-util",
      "version": "0.1.11",
      "source": "registry+https://github.com/rust-lang/crates.io-index",
      "checksum": "c2a7b1c03c876122aa43f3020e6c3c3ee5c05081c9a00739faf7503aeba10d22",
      "allow_custom_build": false,
      "purpose": "Locked same-file closure for safe Windows file-identity handles through final staging validation; supplies no MDB format knowledge."
    },
    {
      "name": "windows-link",
      "version": "0.2.1",
      "source": "registry+https://github.com/rust-lang/crates.io-index",
      "checksum": "f0805222e57f7521d6a62e36fa9163bc891acd422f971defe97d64e70d0a4fe5",
      "allow_custom_build": false,
      "purpose": "Locked rustix and same-file closure for target-specific safe atomic publication; supplies no MDB format knowledge."
    },
    {
      "name": "windows-sys",
      "version": "0.61.2",
      "source": "registry+https://github.com/rust-lang/crates.io-index",
      "checksum": "ae137229bcbd6cdf0f7b80a31df61766145077ddf49416a728b02cb3921ff3fc",
      "allow_custom_build": false,
      "purpose": "Locked rustix and same-file closure for target-specific safe atomic publication; supplies no MDB format knowledge."
    }
  ],
  "format_knowledge": {
    "assertion_files": [
      {
        "path": "crates/jet3-cli/src/main.rs",
        "provenance_ids": [
          "SRC-0004",
          "SRC-0005",
          "EXP-0056",
          "EXP-0065"
        ],
        "sha256": "1aa9d3995bd30d3dbd715adf818b4983f05f55f71f18102460354bb39808f688"
      },
      {
        "path": "crates/jet3/src/allocation.rs",
        "provenance_ids": [
          "SRC-0020"
        ],
        "sha256": "c52b7b405280675b97b9316b6f39019a650a7d7800a0334d7ac000c766a4e82f"
      },
      {
        "path": "crates/jet3/src/allocation_traverse.rs",
        "provenance_ids": [
          "SRC-0020",
          "EXP-0057"
        ],
        "sha256": "815fe531b2e0f8da231a1bddd7dc2f983a0f42956d3b6581c39394541453b3ab"
      },
      {
        "path": "crates/jet3/src/candidate.rs",
        "provenance_ids": [
          "SRC-0004",
          "SRC-0005"
        ],
        "sha256": "0c5c1b59022efcf9c6032e7176a21786c38cc7b7cf31d88219e127384105b486"
      },
      {
        "path": "crates/jet3/src/catalog.rs",
        "provenance_ids": [
          "EXP-0057",
          "EXP-0058",
          "EXP-0059"
        ],
        "sha256": "1f8e8536ec24d97a6c9e6302888e6e488c782367c2a4c492041f219b26d3557e"
      },
      {
        "path": "crates/jet3/src/catalog_record.rs",
        "provenance_ids": [
          "SRC-0020",
          "EXP-0058"
        ],
        "sha256": "e4b06d60700a7abe1a9b55472930781b02659701ee1ae013f03cf18bdc66e144"
      },
      {
        "path": "crates/jet3/src/commit_state.rs",
        "provenance_ids": [
          "SRC-0013"
        ],
        "sha256": "d51cdbaef9c49599e36d40595feb596b6c675556821aef25deeba898150f0acd"
      },
      {
        "path": "crates/jet3/src/column_definition.rs",
        "provenance_ids": [
          "SRC-0023",
          "EXP-0059"
        ],
        "sha256": "99b763a1bd0ccd47318f24f169d6ffd261b756e0cda2ae7919bfc480123ca9ce"
      },
      {
        "path": "crates/jet3/src/data_page_directory.rs",
        "provenance_ids": [
          "EXP-0060",
          "EXP-0061"
        ],
        "sha256": "324bf7f535172d5f5a691d8833c2c965bc1908f9a3f1c2396829316ce9547b0e"
      },
      {
        "path": "crates/jet3/src/database.rs",
        "provenance_ids": [
          "SRC-0004",
          "SRC-0005",
          "SRC-0013",
          "SRC-0020",
          "EXP-0056",
          "EXP-0057"
        ],
        "sha256": "46bbecc16e6eb0c389f64aae741aa7a2d514b25e249b0ddca1825cd86ddd1c9c"
      },
      {
        "path": "crates/jet3/src/database_header.rs",
        "provenance_ids": [
          "SRC-0004",
          "SRC-0005",
          "SRC-0013",
          "EXP-0056"
        ],
        "sha256": "4a9340d94b67f4f97e07575a93b11b92d34738d118add7f3e196162131f3a968"
      },
      {
        "path": "crates/jet3/src/definition_name.rs",
        "provenance_ids": [
          "EXP-0059"
        ],
        "sha256": "622c3c285a01453f3f50700ae9a4fc0c886c8bd95d0876314f3cf6ee5cba5f1a"
      },
      {
        "path": "crates/jet3/src/header.rs",
        "provenance_ids": [
          "SRC-0004",
          "SRC-0005"
        ],
        "sha256": "d45ca6440966401e8b7a4e852db224404c15702a025034d37b12ecab7a84fb99"
      },
      {
        "path": "crates/jet3/src/jet3_page.rs",
        "provenance_ids": [
          "SRC-0005"
        ],
        "sha256": "2b6e6a20ba7ac48250b84ed9a98d6e908a518d1ddd87c0256e8d4b685e1649c6"
      },
      {
        "path": "crates/jet3/src/index_definition.rs",
        "provenance_ids": [
          "EXP-0059",
          "EXP-0062"
        ],
        "sha256": "53713edf32671f438e838c49057c75e6038ada0b10d87b8b2266890ed635af13"
      },
      {
        "path": "crates/jet3/src/index_tree.rs",
        "provenance_ids": [
          "EXP-0062"
        ],
        "sha256": "40f2d099b6416c09e70b51366d51a4555238ab031d94b51ef1fc416085d679bc"
      },
      {
        "path": "crates/jet3/src/index_tree_page.rs",
        "provenance_ids": [
          "EXP-0062"
        ],
        "sha256": "df68286c9796319c6e88eed0644a23bf966a6573d53022da2bb2968e55c2cce2"
      },
      {
        "path": "crates/jet3/src/index_tree_rows.rs",
        "provenance_ids": [
          "EXP-0060",
          "EXP-0062"
        ],
        "sha256": "d702307f87223133f7109ae217e463cb99188c8c494ebcd4efbf27231450409e"
      },
      {
        "path": "crates/jet3/src/long_value.rs",
        "provenance_ids": [
          "EXP-0061"
        ],
        "sha256": "8de0a96b20cbfc78dc04094dd656d4cfe3a7cc847afa0e328ad1d280d15535da"
      },
      {
        "path": "crates/jet3/src/map_location.rs",
        "provenance_ids": [
          "EXP-0057"
        ],
        "sha256": "4fc00ccfaae0ed58e8f6adb82409eb3cf1e6f13fc1475caad519ff419be25c6c"
      },
      {
        "path": "crates/jet3/src/page_kind.rs",
        "provenance_ids": [
          "SRC-0020"
        ],
        "sha256": "fb2699d75e5fcbef9c88bafc7583e19340dd0021e60c465ef69f1b5f8955f497"
      },
      {
        "path": "crates/jet3/src/physical_index_definition.rs",
        "provenance_ids": [
          "EXP-0059"
        ],
        "sha256": "e448c8627c0f1a8598ac332463a5756636b10a6de6a3bfe3f4be28bc8a1f3c6d"
      },
      {
        "path": "crates/jet3/src/raw_page_stream.rs",
        "provenance_ids": [
          "SRC-0005"
        ],